{
  "$schema": "https://json-schema.org/draft/2020-12/schema",
  "$id": "https://github.com/Otzaria/otzaria/tool/release/release_manifest.schema.json",
  "title": "Otzaria release manifest",
  "description": "מתאר את רכיבי ההורדה של release אחד של אוצריא. הסמכות בפועל היא validateReleaseManifest ב-tool/release/generate_release_manifest.dart; הסכמה הזאת היא תיעוד בר-אימות של אותו חוזה. שדות לא מוכרים מותרים בכל רמה — צרכן ישן חייב להמשיך לעבוד מול מניפסט חדש.",
  "type": "object",
  "required": ["schemaVersion", "releaseTag", "releaseVersion", "components"],
  "properties": {
    "schemaVersion": { "const": 1 },
    "releaseTag": { "type": "string", "minLength": 1 },
    "releaseVersion": { "type": "string", "minLength": 1 },
    "components": {
      "type": "array",
      "items": { "$ref": "#/$defs/component" }
    }
  },
  "$defs": {
    "sha256": { "type": "string", "pattern": "^[0-9a-f]{64}$" },
    "assetName": { "type": "string", "pattern": "^[^\\\\/]+$", "minLength": 1 },
    "component": {
      "type": "object",
      "required": [
        "id",
        "name",
        "description",
        "type",
        "required",
        "origin",
        "installOrder",
        "dependsOn",
        "downloadSize",
        "assets"
      ],
      "properties": {
        "id": { "type": "string", "minLength": 1 },
        "name": { "type": "string", "minLength": 1 },
        "description": { "type": "string", "minLength": 1 },
        "nameEn": {
          "type": "string",
          "minLength": 1,
          "description": "השם באנגלית, למסייע שרץ באנגלית. חסר = הצרכן מציג את name."
        },
        "descriptionEn": {
          "type": "string",
          "minLength": 1,
          "description": "התיאור באנגלית. חסר = הצרכן מציג את description."
        },
        "type": {
          "type": "string",
          "minLength": 1,
          "description": "טקסט חופשי בכוונה (application / library / library-index / dependency / semantic-model / semantic-vectors ...). סוג לא מוכר אינו שגיאה."
        },
        "required": { "type": "boolean" },
        "origin": {
          "enum": ["built", "imported"],
          "description": "תיעוד מקור לרישוי בלבד; אינו משפיע על נתיב ההורדה."
        },
        "platform": {
          "type": "string",
          "minLength": 1,
          "description": "windows / linux / macos / android, או any. חסר = מתאים לכל פלטפורמה."
        },
        "architecture": {
          "type": "string",
          "minLength": 1,
          "description": "x64 / arm64, או any. חסר = מתאים לכל ארכיטקטורה (למשל Universal Binary של macOS)."
        },
        "packageFormat": {
          "type": "string",
          "minLength": 1,
          "description": "deb / rpm — רק לחבילת התקנה של מנהל חבילות. חסר = מתאים לכל פורמט שנבחר."
        },
        "installOrder": { "type": "integer" },
        "dependsOn": { "type": "array", "items": { "type": "string" } },
        "installedBy": {
          "type": "array",
          "minItems": 1,
          "items": { "type": "string" },
          "description": "מזהי הרכיבים שמתקינים את הרכיב הזה (מתקין שקורא אותו מהתיקייה שלצדו). המסייע מציע אותו רק ליעד שבו אחד מהם מוצע, ומוריד אותו יחד איתו. רכיב מסוג library או library-index חייב לשאת אותו; מתקין שמופיע כאן אינו נושא installedBy בעצמו."
        },
        "partOf": {
          "type": "string",
          "minLength": 1,
          "description": "מזהה רכיב שהרכיב הזה הוא חלק ממנו, וחייב להופיע ב-dependsOn שלו. בבחירה האישית אין לרכיב שורה משלו: הוא מגיע עם השלם, וגודלו נוסף לשורה של השלם."
        },
        "outputFolder": {
          "type": "string",
          "pattern": "^[A-Za-z0-9._-]+(/[A-Za-z0-9._-]+)*$",
          "description": "תיקייה יחסית בתוך תיקיית הפלט של המסייע שבה נכתבים קובצי הרכיב (למשל semantic-import/vectors); מקטע של נקודות בלבד אסור. חסר = ישירות בתיקיית הפלט."
        },
        "outputNote": {
          "type": "string",
          "minLength": 1,
          "description": "משפט בעברית שהמסייע מוסיף לעמוד הסיום כשהרכיב הוכן — מה עושים בקבצים שלו במחשב היעד."
        },
        "outputNoteEn": {
          "type": "string",
          "minLength": 1,
          "description": "outputNote באנגלית. חסר = הצרכן מציג את outputNote."
        },
        "downloadSize": { "type": "integer", "exclusiveMinimum": 0 },
        "installedSize": { "type": "integer", "exclusiveMinimum": 0 },
        "compatibility": {
          "type": "object",
          "description": "מטא-דאטת התאמה גנרית (מפתחות כמו seforimDbZstSha256, searchEngineVersion, talmudVolumesDigest, libraryReleaseTag) שמאפשרת לצרכן לסרב לצמד לא תואם."
        },
        "assets": {
          "type": "array",
          "minItems": 1,
          "items": { "$ref": "#/$defs/asset" }
        }
      },
      "if": { "properties": { "type": { "enum": ["library", "library-index"] } } },
      "then": { "required": ["installedBy"] }
    },
    "asset": {
      "type": "object",
      "required": ["kind", "repository", "releaseTag", "name", "size", "sha256"],
      "properties": {
        "kind": { "enum": ["single", "split"] },
        "repository": {
          "type": "string",
          "pattern": "^Otzaria/[A-Za-z0-9._-]+$",
          "description": "כתובת הנכס היא תמיד מאגר בארגון Otzaria + תג + שם קובץ. אין URL חופשי."
        },
        "releaseTag": { "type": "string", "minLength": 1 },
        "name": { "$ref": "#/$defs/assetName" },
        "size": { "type": "integer", "exclusiveMinimum": 0 },
        "sha256": { "$ref": "#/$defs/sha256" },
        "manifestAsset": { "$ref": "#/$defs/assetName" },
        "partSizeLimit": { "type": "integer", "exclusiveMinimum": 0 },
        "githubAssetLimit": { "type": "integer", "exclusiveMinimum": 0 },
        "parts": {
          "type": "array",
          "minItems": 1,
          "items": {
            "type": "object",
            "required": ["name", "size", "sha256"],
            "properties": {
              "name": { "$ref": "#/$defs/assetName" },
              "size": {
                "type": "integer",
                "exclusiveMinimum": 0,
                "exclusiveMaximum": 2147483648
              },
              "sha256": { "$ref": "#/$defs/sha256" }
            }
          }
        }
      },
      "allOf": [
        {
          "if": { "properties": { "kind": { "const": "split" } } },
          "then": { "required": ["parts", "manifestAsset"] }
        },
        {
          "if": { "properties": { "kind": { "const": "single" } } },
          "then": {
            "not": { "required": ["parts"] },
            "properties": {
              "size": { "exclusiveMaximum": 2147483648 }
            }
          }
        }
      ]
    }
  }
}
