{
  "schemaVersion": 1,
  "releaseTag": "0.10.3+143",
  "releaseVersion": "0.10.3",
  "components": [
    {
      "id": "otzaria-android",
      "name": "אוצריא ל-Android",
      "nameEn": "Otzaria for Android",
      "description": "קובץ התקנה (APK) לטלפון או לטאבלט. ללא ספרייה.",
      "descriptionEn": "An installation file (APK) for a phone or tablet. Library not included.",
      "type": "application",
      "required": false,
      "origin": "built",
      "platform": "android",
      "installOrder": 10,
      "dependsOn": [],
      "downloadSize": 96,
      "assets": [
        {
          "kind": "single",
          "repository": "Otzaria/otzaria",
          "releaseTag": "0.10.3+143",
          "name": "app-release.apk",
          "size": 96,
          "sha256": "dcc26df7745c49c5f9aaff039715b2f70bea3a20b57170b9942c3b769cea1dfe"
        }
      ]
    },
    {
      "id": "otzaria-linux-deb-arm64",
      "name": "אוצריא ל-Linux (DEB, ARM64)",
      "nameEn": "Otzaria for Linux (DEB, ARM64)",
      "description": "חבילת התקנה ל-Ubuntu, Debian, Mint והפצות דומות, למחשבי ARM64. ללא ספרייה.",
      "descriptionEn": "An installation package for Ubuntu, Debian, Mint and similar distributions, for ARM64 computers. Library not included.",
      "type": "application",
      "required": false,
      "origin": "built",
      "platform": "linux",
      "architecture": "arm64",
      "packageFormat": "deb",
      "installOrder": 10,
      "dependsOn": [],
      "downloadSize": 87,
      "assets": [
        {
          "kind": "single",
          "repository": "Otzaria/otzaria",
          "releaseTag": "0.10.3+143",
          "name": "otzaria-0.10.3+143-linux-arm64.deb",
          "size": 87,
          "sha256": "7e7aaf74769effb46ae0bd04f169f01e3dd1679b35876bb872fe58e96fb53eb7"
        }
      ]
    },
    {
      "id": "otzaria-linux-deb-x64",
      "name": "אוצריא ל-Linux (DEB)",
      "nameEn": "Otzaria for Linux (DEB)",
      "description": "חבילת התקנה ל-Ubuntu, Debian, Mint והפצות דומות, למעבדי x64. ללא ספרייה.",
      "descriptionEn": "An installation package for Ubuntu, Debian, Mint and similar distributions, for x64 processors. Library not included.",
      "type": "application",
      "required": false,
      "origin": "built",
      "platform": "linux",
      "architecture": "x64",
      "packageFormat": "deb",
      "installOrder": 10,
      "dependsOn": [],
      "downloadSize": 96,
      "assets": [
        {
          "kind": "single",
          "repository": "Otzaria/otzaria",
          "releaseTag": "0.10.3+143",
          "name": "otzaria-0.10.3+143-linux.deb",
          "size": 96,
          "sha256": "f381fde169c48c474a74916fdf398c07dfcf34cc03ccefe457cd4b12b8542fbb"
        }
      ]
    },
    {
      "id": "otzaria-linux-rpm-arm64",
      "name": "אוצריא ל-Linux (RPM, ARM64)",
      "nameEn": "Otzaria for Linux (RPM, ARM64)",
      "description": "חבילת התקנה ל-Fedora, openSUSE והפצות דומות, למחשבי ARM64. ללא ספרייה.",
      "descriptionEn": "An installation package for Fedora, openSUSE and similar distributions, for ARM64 computers. Library not included.",
      "type": "application",
      "required": false,
      "origin": "built",
      "platform": "linux",
      "architecture": "arm64",
      "packageFormat": "rpm",
      "installOrder": 10,
      "dependsOn": [],
      "downloadSize": 127,
      "assets": [
        {
          "kind": "single",
          "repository": "Otzaria/otzaria",
          "releaseTag": "0.10.3+143",
          "name": "otzaria-0.10.3+143-143.aarch64.rpm",
          "size": 127,
          "sha256": "07faee3b4c55e4c23ca17eabb518f9456a81c503407f2af478d3edf9e4e0a865"
        }
      ]
    },
    {
      "id": "otzaria-linux-rpm-x64",
      "name": "אוצריא ל-Linux (RPM)",
      "nameEn": "Otzaria for Linux (RPM)",
      "description": "חבילת התקנה ל-Fedora, openSUSE והפצות דומות, למעבדי x64. ללא ספרייה.",
      "descriptionEn": "An installation package for Fedora, openSUSE and similar distributions, for x64 processors. Library not included.",
      "type": "application",
      "required": false,
      "origin": "built",
      "platform": "linux",
      "architecture": "x64",
      "packageFormat": "rpm",
      "installOrder": 10,
      "dependsOn": [],
      "downloadSize": 132,
      "assets": [
        {
          "kind": "single",
          "repository": "Otzaria/otzaria",
          "releaseTag": "0.10.3+143",
          "name": "otzaria-0.10.3+143-143.x86_64.rpm",
          "size": 132,
          "sha256": "00b0d4e60dc48066ae60fc2e5e041e60e7788aba5628bfb717d326f9705bc698"
        }
      ]
    },
    {
      "id": "otzaria-macos",
      "name": "אוצריא ל-macOS",
      "nameEn": "Otzaria for macOS",
      "description": "קובץ DMG: גוררים ממנו את אוצריא לתיקיית היישומים. ללא ספרייה.",
      "descriptionEn": "A DMG file: drag Otzaria from it into the Applications folder. Library not included.",
      "type": "application",
      "required": false,
      "origin": "built",
      "platform": "macos",
      "installOrder": 10,
      "dependsOn": [],
      "downloadSize": 86,
      "assets": [
        {
          "kind": "single",
          "repository": "Otzaria/otzaria",
          "releaseTag": "0.10.3+143",
          "name": "otzaria-macos.dmg",
          "size": 86,
          "sha256": "397340a23d6c3d08bb2511354a7490a8fde6cd8772b5bd46c1956b89855db462"
        }
      ]
    },
    {
      "id": "otzaria-windows-arm64",
      "name": "אוצריא ל-Windows (ARM64)",
      "nameEn": "Otzaria for Windows (ARM64)",
      "description": "התוכנה עצמה למחשבי ARM64, ללא ספרייה.",
      "descriptionEn": "Otzaria itself for ARM64 computers, without the library.",
      "type": "application",
      "required": false,
      "origin": "built",
      "platform": "windows",
      "architecture": "arm64",
      "installOrder": 10,
      "dependsOn": [],
      "downloadSize": 38,
      "assets": [
        {
          "kind": "single",
          "repository": "Otzaria/otzaria",
          "releaseTag": "0.10.3+143",
          "name": "otzaria-0.10.3-windows_arm64.exe",
          "size": 38,
          "sha256": "77e80029d0c8861cc444ecc810c943356e8301991f319af5df5ad2788928641e"
        }
      ]
    },
    {
      "id": "otzaria-windows-portable-arm64",
      "name": "אוצריא ל-Windows — גרסה ניידת (ARM64)",
      "nameEn": "Otzaria for Windows — Portable Version (ARM64)",
      "description": "ארכיון ZIP שאינו דורש התקנה, למחשבי ARM64.",
      "descriptionEn": "A ZIP archive that needs no installation, for ARM64 computers.",
      "type": "application-portable",
      "required": false,
      "origin": "built",
      "platform": "windows",
      "architecture": "arm64",
      "installOrder": 10,
      "dependsOn": [],
      "downloadSize": 44,
      "assets": [
        {
          "kind": "single",
          "repository": "Otzaria/otzaria",
          "releaseTag": "0.10.3+143",
          "name": "otzaria-windows_arm64.zip",
          "size": 44,
          "sha256": "3177142eea86d9402672f3f34129718eda53b43c140528035b2710f4231aa911"
        }
      ]
    },
    {
      "id": "otzaria-windows-portable-x64",
      "name": "אוצריא ל-Windows — גרסה ניידת",
      "nameEn": "Otzaria for Windows — Portable Version",
      "description": "ארכיון ZIP שאינו דורש התקנה, למעבדי x64.",
      "descriptionEn": "A ZIP archive that needs no installation, for x64 processors.",
      "type": "application-portable",
      "required": false,
      "origin": "built",
      "platform": "windows",
      "architecture": "x64",
      "installOrder": 10,
      "dependsOn": [],
      "downloadSize": 45,
      "assets": [
        {
          "kind": "single",
          "repository": "Otzaria/otzaria",
          "releaseTag": "0.10.3+143",
          "name": "otzaria-windows.zip",
          "size": 45,
          "sha256": "795a6e77a5d7b7760931a5cccf8cd3ae4e3e0f85feee30b1a321f862fea90799"
        }
      ]
    },
    {
      "id": "otzaria-windows-x64",
      "name": "אוצריא ל-Windows",
      "nameEn": "Otzaria for Windows",
      "description": "התוכנה עצמה, ללא ספרייה. מתקין רגיל למעבדי x64.",
      "descriptionEn": "Otzaria itself, without the library. A standard installer for x64 processors.",
      "type": "application",
      "required": true,
      "origin": "built",
      "platform": "windows",
      "architecture": "x64",
      "installOrder": 10,
      "dependsOn": [],
      "downloadSize": 39,
      "assets": [
        {
          "kind": "single",
          "repository": "Otzaria/otzaria",
          "releaseTag": "0.10.3+143",
          "name": "otzaria-0.10.3-windows.exe",
          "size": 39,
          "sha256": "9831e46a12f0fe126c702d1c79974403d871553e9a3a229369a6c68593baa523"
        }
      ]
    },
    {
      "id": "otzaria-linux-full-arm64",
      "name": "אוצריא ל-Linux עם ספרייה מלאה (ARM64)",
      "nameEn": "Otzaria for Linux with the Full Library (ARM64)",
      "description": "ארכיון tar.zst ובו התוכנה והספרייה המלאה, למחשבי ARM64. פורסים אותו ומפעילים ללא התקנה.",
      "descriptionEn": "A tar.zst archive with Otzaria and the full library, for ARM64 computers. Extract it and run Otzaria, no installation needed.",
      "type": "application-bundle",
      "required": false,
      "origin": "built",
      "platform": "linux",
      "architecture": "arm64",
      "installOrder": 20,
      "dependsOn": [],
      "downloadSize": 1900,
      "assets": [
        {
          "kind": "single",
          "repository": "Otzaria/otzaria",
          "releaseTag": "0.10.3+143",
          "name": "otzaria-linux-full-arm64.tar.zst",
          "size": 1900,
          "sha256": "0b0276d8f9cabee914c2eb10b0651dff7a242b5815db5124e4edfafc1d6a2fab"
        }
      ]
    },
    {
      "id": "otzaria-linux-full-x64",
      "name": "אוצריא ל-Linux עם ספרייה מלאה",
      "nameEn": "Otzaria for Linux with the Full Library",